[
  {
    "plan_name": "教师楷书每日15分钟精进计划",
    "duration_minutes": 15,
    "is_mock": false,
    "items": [
      {
        "text": "永",
        "repeat": 5,
        "task_type": "描红",
        "instruction": "先用1分钟读帖，观察「永」字八法中点、横、竖、钩、撇、捺的形态与位置关系；再描红5遍，注意横画微斜、竖画垂直，起笔顿笔、收笔干净，夯实楷书笔画基本功。"
      },
      {
        "text": "温故知新",
        "repeat": 4,
        "task_type": "临摹",
        "instruction": "对照字帖临写「温故知新」4遍，重点把握独体字重心平稳、合体字左右比例与穿插避让；写完逐字与字帖对比，用红笔圈出比例失衡或重心不稳的字，次日优先改正。"
      }
    ]
  },
  {
    "plan_name": "课堂板书行楷5分钟速练计划",
    "duration_minutes": 5,
    "is_mock": false,
    "items": [
      {
        "text": "重点、例题、总结",
        "repeat": 3,
        "task_type": "描红",
        "instruction": "描红板书高频词「重点」「例题」「总结」各3遍，手腕放松，注意行楷连笔的自然衔接与字形大小统一，目标是写得又快又清楚，可直接迁移到课堂板书中。"
      }
    ]
  },
  {
    "plan_name": "行书工整度30分钟提升计划",
    "duration_minutes": 30,
    "is_mock": false,
    "items": [
      {
        "text": "的、是、我、到",
        "repeat": 5,
        "task_type": "临摹",
        "instruction": "讲解要点：行书连带讲究「笔断意连」，横竖可连、撇捺可连，但连笔流畅不等于潦草，字形轮廓要保持清晰。理解后对照字帖临写这4个高频字各5遍，体会连笔处虚实的转换。"
      },
      {
        "text": "静水流深",
        "repeat": 3,
        "task_type": "描红",
        "instruction": "描红「静水流深」3遍，注意字距均匀、字形大小控制在格子的七八成、行气贯通，体会行书「连中有断、快中有稳」的节奏，这是写工整的关键。"
      },
      {
        "text": "静水流深",
        "repeat": 2,
        "task_type": "默写",
        "instruction": "脱帖默写「静水流深」2遍，写完与字帖逐字对比，用红笔圈出连笔生硬、重心不稳或结构松散的字，针对问题字再重写一遍，完成「讲解—练习—默写纠错」的完整闭环。"
      }
    ]
  }
]